{
  "$schema": "http://json-schema.org/draft-07/schema#",
  "$id": "https://databricks-solutions.github.io/consort/schemas/architecture.schema.json",
  "title": "Architecture",
  "description": "The Architect Reviewer's structured output for a feature, persisted as features/<F>/architecture.json (the machine-checkable companion to architecture.md). NFRs live HERE, not on the spec-author-owned, spec-gated feature-spec.json/story.json: the architect proposes them and the HIL (Product Owner) accepts or modifies them at Gate 2. Moving NFRs off feature-spec.json resolves the spec-gate integrity drift: the architect annotating feature-spec.json after the spec gate hashed it tripped verify-gate-integrity.",
  "type": "object",
  "required": ["feature_id", "service_backed", "nfrs"],
  "properties": {
    "feature_id": {
      "type": "string",
      "pattern": "^F[0-9]+(-[a-z0-9-]+)?$"
    },
    "service_backed": {
      "type": "boolean",
      "description": "REQUIRED, explicit boolean (no silent omission): the architect must make a deliberate call. True when the feature persists data or carries business logic (anything beyond a trivial static/read-through endpoint); then it MUST declare layered `layers` (boundary+service+repository) and a layering fitness test, and checkLayeringDeclared/checkFitnessCoverage hard-block the gate. False ONLY for a trivial feature (the YAGNI guard). A false/absent declaration is cross-checked against evidence: checkServiceBackedDeclaration hard-blocks the gate when the feature shows persistence evidence (an Infra-layer AC, or an NFR about migrations/schema/storage), so under-declaration cannot silently disable layering enforcement."
    },
    "layers": {
      "type": "array",
      "description": "The module layering the build must realize (boundary -> service -> repository -> ORM, dependencies inward). Required in substance for a service_backed feature. The boundary never imports the DB session; persistence lives only in the repository; business logic only in the service.",
      "items": {
        "type": "object",
        "required": ["role", "module"],
        "properties": {
          "name": { "type": "string" },
          "role": {
            "type": "string",
            "enum": ["boundary", "service", "repository", "models", "infrastructure", "policy"]
          },
          "module": {
            "type": "string",
            "description": "Path/dotted-module this layer lives in (e.g. app/routes, app/services, app/repositories). For the `models` role declare a PACKAGE directory (app/models/, trailing slash), one module per domain object/aggregate, NOT a flat app/models.py; checkModulePlacement enforces the package shape and the architecture-conventions check keeps it consistent across features."
          },
          "may_import": {
            "type": "array",
            "items": { "type": "string" },
            "description": "Layer roles this one is allowed to depend on (inward). Empty/omitted means it depends on nothing inward."
          },
          "renders_via": {
            "type": "string",
            "description": "Boundary layer only (UI features): the templating framework the boundary renders through (e.g. \"jinja2\" + a templates/ dir). The boundary returns a rendered template, never an inline HTML string; consort-layering-clean flags inline HTML with no templating seam. Omit for API/CLI/Infra boundaries that return data, not markup."
          }
        },
        "additionalProperties": false
      }
    },
    "persistence_invariants": {
      "type": "array",
      "description": "The DB-level guarantees the schema must enforce (the persistence contract), for a feature that persists data. This array is the source of truth for 'this feature has a database': a service does NOT always mean a database, so a service_backed compute/proxy/aggregator that persists nothing declares NONE here (and is then routed past the DBA + DB-integration tests). Each declared invariant is covered by a real-branch test (a test-list item referencing its id via invariant_id) and physically realized by the DBA; checkPersistenceCoverage/checkDbDesign hard-block Gate 3 when a feature that DID declare invariants leaves one uncovered/unrealized. The safety net against under-declaring a feature that really persists is checkServiceBackedDeclaration (persistence evidence , an Infra AC or a storage/migration NFR , forces invariants). These drive DB-integration coverage tied to the schema's own contract, verifying the MIGRATION realized each guarantee against the branch, NOT the ORM's generic behavior.",
      "items": {
        "type": "object",
        "required": ["id", "type", "brief"],
        "properties": {
          "id": {
            "type": "string",
            "description": "Stable id, e.g. \"PI1-stock-sku-location-unique\". Referenced by a test-list item's invariant_id."
          },
          "type": {
            "type": "string",
            "enum": ["unique", "foreign_key", "cascade", "not_null", "check", "transactional", "migration_reversible"],
            "description": "The class of guarantee: a unique key, an FK, a cascade rule, a NOT NULL, a CHECK, a transactional-atomicity boundary, or migration up-then-down reversibility."
          },
          "table": {
            "type": "string",
            "description": "The table (and, in brief, columns) the invariant applies to. Omit for a purely transactional/migration invariant."
          },
          "brief": {
            "type": "string",
            "minLength": 1,
            "description": "One line: the guarantee to verify against the real branch (e.g. \"inserting two rows with the same (sku, location) is rejected\")."
          }
        },
        "additionalProperties": false
      }
    },
    "nfrs": {
      "type": "array",
      "description": "Non-functional requirements proposed by the architect, adjudicated by the HIL at Gate 2. An empty array is valid (a feature may have no NFRs), but every entry that exists must be HIL-considered, not unconsidered. Each NFR states its requirement (via `brief`, or the legacy `requirement`) and, per @architectural-design-principles, NAMES the fitness function that defends it (`fitness_function`) so the Test Strategist authors it as a RED test.",
      "items": {
        "type": "object",
        "anyOf": [
          { "required": ["brief"] },
          { "required": ["requirement"] }
        ],
        "properties": {
          "id": {
            "type": "string",
            "description": "Stable NFR id, e.g. \"NFR-F1-durability-migrations\". Read by the context rubric + downstream roles."
          },
          "category": {
            "type": "string",
            "minLength": 1,
            "description": "The NFR quality attribute, e.g. performance / scalability / security / observability / operability / resilience / durability / correctness / testability / usability / configurability. A free string (the quality-attribute set is open), not a fixed enum."
          },
          "requirement": {
            "type": "string",
            "minLength": 1,
            "description": "Legacy field for the requirement statement. Prefer `brief`. One of `brief`/`requirement` is required."
          },
          "brief": {
            "type": "string",
            "minLength": 1,
            "description": "One line stating the requirement (e.g. \"existing rows survive every additive migration\"). The field the context rubric + downstream roles read; one of `brief`/`requirement` is required."
          },
          "fitness_function": {
            "type": "string",
            "description": "The concrete, real-branch test that DEFENDS this NFR (e.g. \"integration test applies the Alembic revision over seeded rows and asserts survival + clean down\"). Per @architectural-design-principles every architectural constraint names the fitness function that defends it, recorded so the Test Strategist authors it as a RED test. Omit only for an NFR with no machine-checkable defense."
          },
          "notes": { "type": "string" },
          "applies_to": {
            "type": "string",
            "description": "Feature or story id this NFR scopes to. Omit for feature-wide NFRs."
          },
          "hil_status": {
            "type": "string",
            "enum": ["proposed", "accepted", "modified", "rejected"],
            "default": "proposed",
            "description": "Architect proposes; the HIL accepts/modifies/rejects at Gate 2."
          },
          "brief_ref": {
            "type": "string",
            "pattern": "^R[0-9]+$",
            "description": "The R<n> id of the nfrs.md Required item this NFR satisfies. Every Required item in the HIL's nfrs.md must be covered by some architecture.json nfr carrying its id here, or checkNfrCoverage hard-blocks the architecture gate. Omit for architect-originated NFRs that no Required item drove."
          }
        },
        "additionalProperties": false
      }
    }
  },
  "additionalProperties": false
}
