{
  "feature_id": "F6-split-tracking-code",
  "service_backed": true,
  "layers": [
    {
      "name": "stock-boundary",
      "role": "boundary",
      "module": "app/routes",
      "renders_via": "react",
      "may_import": ["service"]
    },
    {
      "name": "stock-service",
      "role": "service",
      "module": "app/services",
      "may_import": ["repository", "models"]
    },
    {
      "name": "stock-repository",
      "role": "repository",
      "module": "app/repositories",
      "may_import": ["models"]
    },
    {
      "name": "stock-models",
      "role": "models",
      "module": "app/models",
      "may_import": []
    }
  ],
  "persistence_invariants": [
    {
      "id": "PI1-migration-reversible",
      "type": "migration_reversible",
      "table": "stock",
      "brief": "The up migration (add batch_number/serial_number, backfill, drop inventory_code) has a down migration that re-adds inventory_code and reconstructs it from location + batch + serial; up then down leaves the schema and conforming rows round-tripped (reconstruction is lossy only for nonconforming rows left NULL). VERIFIED BY A kind:fitness TEST MARKED @pytest.mark.migration ON AN ISOLATED EPHEMERAL BRANCH, never by downgrading the shared verify branch (canon: do not downgrade the shared verify database)."
    },
    {
      "id": "PI2-sku-location-unique-preserved",
      "type": "unique",
      "table": "stock",
      "brief": "The UNIQUE(sku, location) key established in F1 survives this migration unchanged; splitting the code neither drops nor duplicates the constraint and location stays the canonical addressing column."
    },
    {
      "id": "PI3-batch-serial-nullable",
      "type": "not_null",
      "table": "stock",
      "brief": "batch_number and serial_number are added as NULLABLE (no NOT NULL): nonconforming codes must persist as NULL rather than being defaulted or forcing the row out, so the columns carry no NOT NULL constraint."
    },
    {
      "id": "PI4-row-survival",
      "type": "check",
      "table": "stock",
      "brief": "Every pre-migration stock row (quantity, sku, location) is still present and retrievable after the up migration; no row is dropped whether or not its code parsed. VERIFIED BY THE ISOLATED kind:fitness @pytest.mark.migration TEST (same isolated ephemeral branch as PI1/AC6): seed a mixed pre-migration seed, run `alembic upgrade`, then assert every seeded row survives with quantity/sku/location intact. NOT verifiable on the shared UP-state branch, the migration is already applied there so pre-migration rows cannot be seeded and the up migration cannot be observed in flight."
    }
  ],
  "nfrs": [
    {
      "id": "NFR-F6-data-survival",
      "applies_to": "F6-split-tracking-code",
      "brief_ref": "R1",
      "category": "reliability",
      "brief": "Every sprint-1 stock row survives the schema refactor with no loss: conforming codes backfill batch/serial, nonconforming codes persist with NULL batch/serial, and no row is dropped. Backfill VALUE correctness (AC1/AC2 batch/serial populated or NULL) is asserted on the shared UP-state branch; whole-row SURVIVAL across the up migration (PI4) is asserted by the isolated @pytest.mark.migration fitness test (seed pre-migration rows -> upgrade -> assert survival), since the shared branch cannot seed pre-migration rows.",
      "hil_status": "accepted"
    },
    {
      "id": "NFR-F6-sku-location-unique",
      "applies_to": "F6-split-tracking-code",
      "brief_ref": "R3",
      "category": "data-integrity",
      "brief": "UNIQUE(sku, location) is preserved through the migration; location remains canonical and is never overwritten from the code's leading segment.",
      "hil_status": "accepted"
    },
    {
      "id": "NFR-F6-real-branch-tests",
      "applies_to": "F6-split-tracking-code",
      "brief_ref": "R4",
      "category": "testability",
      "brief": "All acceptance tests run against a real Lakebase branch (databricks_postgres via DATABASE_URL) with Alembic migrations applied; no mock, stub, or in-memory DB. UP-state behavior tests (AC1-AC5) run on the shared verify branch; the DOWN migration (AC6) is exercised only by a kind:fitness @pytest.mark.migration test on an ISOLATED ephemeral branch (up-then-down round-trip), because downgrading the shared branch would drop batch_number/serial_number and break every UP-state test.",
      "hil_status": "accepted"
    },
    {
      "id": "NFR-F6-reversibility",
      "applies_to": "S1-split-and-backfill-migration",
      "category": "maintainability",
      "brief": "The migration is reversible: the down path reconstructs inventory_code from location + batch + serial and restores the combined column, enabling rollback during rollout (additive-where-possible preference). The reverse path is exercised ONLY on an isolated ephemeral branch by a kind:fitness @pytest.mark.migration test (up-then-down round-trip); the shared verify branch is never downgraded, so AC1-AC5's UP-state behavior tests stay valid.",
      "hil_status": "accepted"
    },
    {
      "id": "NFR-F6-integrity-probe",
      "applies_to": "S1-split-and-backfill-migration",
      "category": "observability",
      "brief": "A migration-time integrity probe reports the count of nonconforming rows (codes that could not be parsed into batch and serial) for review before the change is accepted; delimiter-only parsing, no fabrication.",
      "hil_status": "accepted"
    },
    {
      "id": "NFR-F6-react-spa",
      "applies_to": "F6-split-tracking-code",
      "brief_ref": "R5",
      "category": "usability",
      "brief": "N/A for S1 (a headless schema migration with no UI surface); the boundary stays a React SPA + JSON API for the downstream S2 view story, inheriting the F1 convention. No server-rendered HTML.",
      "hil_status": "accepted"
    }
  ]
}
