{
  "feature_id": "F1-stock-visibility",
  "service_backed": true,
  "layers": [
    {
      "name": "API boundary",
      "role": "boundary",
      "module": "app/routes/",
      "renders_via": "react",
      "may_import": ["service"]
    },
    {
      "name": "Stock service",
      "role": "service",
      "module": "app/services/",
      "may_import": ["repository", "models"]
    },
    {
      "name": "Stock repository",
      "role": "repository",
      "module": "app/repositories/",
      "may_import": ["models"]
    },
    {
      "name": "Domain models",
      "role": "models",
      "module": "app/models/",
      "may_import": []
    }
  ],
  "persistence_invariants": [
    {
      "id": "PI1-stock-sku-location-unique",
      "type": "unique",
      "table": "stock",
      "brief": "Composite unique constraint on (sku, location): no two rows share the same SKU/location pair (NFR R3)."
    },
    {
      "id": "PI2-stock-quantity-nonnegative",
      "type": "check",
      "table": "stock",
      "brief": "CHECK quantity >= 0: a stock quantity can never be persisted below zero (NFR R2)."
    },
    {
      "id": "PI3-stock-required-fields-not-null",
      "type": "not_null",
      "table": "stock",
      "brief": "sku, location, and quantity are NOT NULL; a stock record cannot exist without its identifying pair and quantity."
    },
    {
      "id": "PI4-refile-upsert-atomic",
      "type": "transactional",
      "table": "stock",
      "brief": "A refile of an existing (sku, location) pair is a single atomic upsert; on collision the existing row is updated in one transaction, never inserted as a duplicate (NFR R3, AC3)."
    },
    {
      "id": "PI5-migration-reversible",
      "type": "migration_reversible",
      "table": "stock",
      "brief": "The Alembic migration creating the stock table has a working downgrade and preserves pre-existing inventory records on upgrade (NFR R1)."
    }
  ],
  "nfrs": [
    {
      "id": "NFR-F1-data-durability",
      "category": "reliability",
      "applies_to": "F1-stock-visibility",
      "brief_ref": "R1",
      "brief": "Existing stock data survives every schema migration with no loss; model changes are additive and pre-existing inventory records are preserved (PI5). Adjustment audit fields (timestamp, actor) are immutable once written.",
      "hil_status": "proposed"
    },
    {
      "id": "NFR-F1-no-negative-overcommit",
      "category": "correctness",
      "applies_to": "F1-stock-visibility",
      "brief_ref": "R2",
      "brief": "Stock levels never go below zero and never overcommit; enforced at write time in the service layer and by a DB CHECK constraint (PI2). Note: the pick/overcommit flow is out of S1 scope but the non-negative floor is realized here.",
      "hil_status": "proposed"
    },
    {
      "id": "NFR-F1-sku-location-uniqueness",
      "category": "correctness",
      "applies_to": "S1-file-stock",
      "brief_ref": "R3",
      "brief": "Every (sku, location) pair is uniquely addressable; a collision is resolved at write time via atomic upsert (PI1, PI4), never stored as a duplicate and never surfaced as an error page (AC3).",
      "hil_status": "proposed"
    },
    {
      "id": "NFR-F1-real-branch-integration-tests",
      "category": "testability",
      "applies_to": "F1-stock-visibility",
      "brief_ref": "R4",
      "brief": "Acceptance tests are real integration tests (pytest-bdd) against the paired Lakebase branch via DATABASE_URL, never a mock or in-memory substitute; CI refuses to merge if integration tests do not run against a real branch.",
      "hil_status": "proposed"
    },
    {
      "id": "NFR-F1-spa-json-boundary",
      "category": "architecture",
      "applies_to": "F1-stock-visibility",
      "brief_ref": "R5",
      "brief": "The UI is a React + TypeScript single-page app under client/; the API boundary returns JSON (not server-rendered HTML), so the boundary layer declares renders_via: react. Client-side navigation with no full-page reloads; adjustments update the affected row in place.",
      "hil_status": "proposed"
    },
    {
      "id": "NFR-F1-validation-messages",
      "category": "usability",
      "applies_to": "S1-file-stock",
      "brief": "Validation errors name the offending field rather than a generic 'bad request'. Owned at the API boundary (PO preference). REQUIRED coverage: a real-branch behavior/fitness test must POST an invalid file payload (e.g. negative quantity, missing required field) to the boundary endpoint and assert the HTTP error response body NAMES the offending field. This is a boundary-response contract distinct from the service-layer 'validation before any DB write' check — the service test does not exercise the HTTP response shape and does not satisfy this NFR.",
      "hil_status": "proposed"
    },
    {
      "id": "NFR-F1-empty-state-clean-render",
      "category": "usability",
      "applies_to": "S2-view-home-stock-table",
      "brief": "The home stock read view renders cleanly in every data state: with rows it shows the scannable table; with no rows it shows an explicit empty-state message ('No stock at this location'), never a blank region and never a null crash (nfrs.md clean-render preference, AC3). The read endpoint returns an empty JSON collection on no data (never a 4xx/5xx), owned at the boundary; empty-state and quantity-column alignment are view responsibilities in the React SPA (client/).",
      "hil_status": "proposed"
    },
    {
      "id": "NFR-F1-sku-detail-clean-render",
      "category": "usability",
      "applies_to": "S3-view-sku-detail",
      "brief": "The SKU-detail read view renders cleanly regardless of optional-field presence: it lists every location/quantity for the SKU and shows the tracking code exactly as filed; a missing par level (or other optional detail) shows an explicit 'not tracked' rather than a blank region, a null value, or an error (nfrs.md clean-render preference, S3-AC3). The read endpoint emits a clean JSON collection with nulls preserved for unrecorded optional fields (never a 4xx/5xx), owned at the boundary; the 'not tracked' presentation is a view responsibility in the React SPA (client/).",
      "hil_status": "proposed"
    }
  ]
}
